Last login: Wed Apr 26 12:04:24 on ttys002

The default interactive shell is now zsh.
To update your account to use zsh, please run `chsh -s /bin/zsh`.
For more details, please visit https://support.apple.com/kb/HT208050.
nirmala-pt7167:~ nirmala-pt7167$ mysql -u root
Welcome to the MySQL monitor.  Commands end with ; or \g.
Your MySQL connection id is 32
Server version: 5.7.41 Homebrew

Copyright (c) 2000, 2023, Oracle and/or its affiliates.

Oracle is a registered trademark of Oracle Corporation and/or its
affiliates. Other names may be trademarks of their respective
owners.

Type 'help;' or '\h' for help. Type '\c' to clear the current input statement.

mysql> USE NIRMALA;
Reading table information for completion of table and column names
You can turn off this feature to get a quicker startup with -A

Database changed
mysql> SHOW TABLES;
+-------------------+
| Tables_in_nirmala |
+-------------------+
| BINARY1           |
| BOOKS             |
| COURSE            |
| COURSE_CREDITS    |
| COURSE_DETAILS    |
| Child2            |
| Child3            |
| Customer          |
| CustomerCanada    |
| CustomerUSA       |
| EE_CLASS_DETAILS  |
| Employee          |
| ORDERS            |
| PREREQ            |
| Parent            |
| STRINGS1          |
| STUDENTS          |
| STUDENT_COURSE    |
| STUDENT_HOBBY     |
| STUDENT_LIST      |
| TEACHERS          |
| TEACHERSALARY     |
| TIME1             |
| TIMEZONE_TEST     |
| Users             |
| YR_LEVEL          |
+-------------------+
26 rows in set (0.01 sec)

mysql> #sql transactions
mysql> 
mysql> START TRANSACTION;
Query OK, 0 rows affected (0.00 sec)

mysql> SELECT MAX(SALARY) FROM TEACHERSALARY;
+-------------+
| MAX(SALARY) |
+-------------+
|       75000 |
+-------------+
1 row in set (0.01 sec)

mysql> INSERT INTO STUDENTS VALUES
    -> ('S03',1003,'Lilly','Erickson','2000-05-21','CS02','F',6700,'CS-315');
Query OK, 1 row affected (0.00 sec)

mysql> INSERT INTO COURSES VALUES
    -> ('EE-216','Electromagnetism','Electrical',4);
ERROR 1146 (42S02): Table 'nirmala.courses' doesn't exist
mysql> INSERT INTO COURSE VALUES ('EE-216','Electromagnetism','Electrical',4);
Query OK, 1 row affected (0.00 sec)

mysql> INSERT INTO TEACHERS(NAME,COURSE_ID) VALUES ('Reena','EE-216');
Query OK, 1 row affected (0.00 sec)

mysql> COMMIT;
Query OK, 0 rows affected (0.01 sec)

mysql> 
mysql> 
mysql> #rollback
mysql> 
mysql> START TRANSACTION;
Query OK, 0 rows affected (0.01 sec)

mysql> DELETE FROM TEACHERS;
Query OK, 4 rows affected (0.00 sec)

mysql> SELECT * FROM TEACHERS;
Empty set (0.01 sec)

mysql> ROLLBACK;
Query OK, 0 rows affected (0.01 sec)

mysql> SELECT * FROM TEACHERS;
+-----+---------+-----------+
| TID | NAME    | COURSE_ID |
+-----+---------+-----------+
|   1 | Maya    | CS-101    |
|   2 | Anu     | BIO-301   |
|   3 | Patrick | CS-315    |
|   5 | Reena   | EE-216    |
+-----+---------+-----------+
4 rows in set (0.00 sec)

mysql> #savepoint
mysql> 
mysql> START TRANSACTION;
Query OK, 0 rows affected (0.00 sec)

mysql> INSERT INTO TEACHERS(NAME,COURSE_ID) VALUES ('Arun','CS-190');
Query OK, 1 row affected (0.00 sec)

mysql> SAVEPOINT SPNT1;
Query OK, 0 rows affected (0.01 sec)

mysql> INSERT INTO TEACHERS(NAME,COURSE_ID) VALUES ('Arjun','CS-190');
Query OK, 1 row affected (0.00 sec)

mysql> SELECT * FROM TEACHERS;
+-----+---------+-----------+
| TID | NAME    | COURSE_ID |
+-----+---------+-----------+
|   1 | Maya    | CS-101    |
|   2 | Anu     | BIO-301   |
|   3 | Patrick | CS-315    |
|   5 | Reena   | EE-216    |
|   6 | Arun    | CS-190    |
|   7 | Arjun   | CS-190    |
+-----+---------+-----------+
6 rows in set (0.00 sec)

mysql> ROLLBACK TO SAVEPOINT SPNT1;
Query OK, 0 rows affected (0.01 sec)

mysql> INSERT INTO TEACHERS(NAME,COURSE_ID) VALUES ('Ajitha','BIO-101');
Query OK, 1 row affected (0.00 sec)

mysql> COMMIT;
Query OK, 0 rows affected (0.00 sec)

mysql> SELECT * FROM TEACHERS;
+-----+---------+-----------+
| TID | NAME    | COURSE_ID |
+-----+---------+-----------+
|   1 | Maya    | CS-101    |
|   2 | Anu     | BIO-301   |
|   3 | Patrick | CS-315    |
|   5 | Reena   | EE-216    |
|   6 | Arun    | CS-190    |
|   8 | Ajitha  | BIO-101   |
+-----+---------+-----------+
6 rows in set (0.00 sec)

mysql> #release savepoint
mysql> 
mysql> START TRANSACTION;
Query OK, 0 rows affected (0.01 sec)

mysql> INSERT INTO COURSE VALUES
    -> ('MAT-208','Calculus','Mathematics',4);
Query OK, 1 row affected (0.00 sec)

mysql> SAVEPOINT SPNT2;
Query OK, 0 rows affected (0.01 sec)

mysql> INSERT INTO TEACHERS(NAME,COURSE_ID) VALUES ('Iqbal','MAT-208');
Query OK, 1 row affected (0.00 sec)

mysql> RELEASE SAVEPOINT SPNT2;
Query OK, 0 rows affected (0.00 sec)

mysql> ROLLBACK TO SAVEPOINT SPNT2;
ERROR 1305 (42000): SAVEPOINT SPNT2 does not exist
mysql> COMMIT;
Query OK, 0 rows affected (0.01 sec)

mysql> SELECT * FROM TEACHERS;
+-----+---------+-----------+
| TID | NAME    | COURSE_ID |
+-----+---------+-----------+
|   1 | Maya    | CS-101    |
|   2 | Anu     | BIO-301   |
|   3 | Patrick | CS-315    |
|   5 | Reena   | EE-216    |
|   6 | Arun    | CS-190    |
|   8 | Ajitha  | BIO-101   |
|   9 | Iqbal   | MAT-208   |
+-----+---------+-----------+
7 rows in set (0.00 sec)

mysql> SELECT * FROM COURSE;
+-----------+------------------+-------------+---------+
| COURSE_ID | TITLE            | DEPT_NAME   | CREDITS |
+-----------+------------------+-------------+---------+
| BIO-101   | Basic Biology    | Biology     |       4 |
| BIO-301   | Genetics         | Biology     |       4 |
| CS-101    | Basic Prgm       | Comp. Sci.  |       3 |
| CS-190    | Game Design      | Comp. Sci.  |       4 |
| CS-315    | Robotocs         | Comp. Sci.  |       3 |
| EE-216    | Electromagnetism | Electrical  |       4 |
| MAT-208   | Calculus         | Mathematics |       4 |
+-----------+------------------+-------------+---------+
7 rows in set (0.00 sec)

mysql> INSERT INTO TEACHERS(NAME,COURSE_ID) VALUES ('Arjun','CS-190');
Query OK, 1 row affected (0.01 sec)

mysql> ROLLBACK;
Query OK, 0 rows affected (0.00 sec)

mysql> SELECT * FROM TEACHERS;                           +-----+---------+-----------+
| TID | NAME    | COURSE_ID |
+-----+---------+-----------+
|   1 | Maya    | CS-101    |
|   2 | Anu     | BIO-301   |
|   3 | Patrick | CS-315    |
|   5 | Reena   | EE-216    |
|   6 | Arun    | CS-190    |
|   8 | Ajitha  | BIO-101   |
|   9 | Iqbal   | MAT-208   |
|  10 | Arjun   | CS-190    |
+-----+---------+-----------+
8 rows in set (0.00 sec)

mysql> 
mysql> #ACID PROPERTIES
mysql> 
mysql> CREATE TABLE ACID_PROP(ID BIGINT AUTO_INCREMENT,
    -> VALUE VARCHAR(30));
ERROR 1075 (42000): Incorrect table definition; there can be only one auto column and it must be defined as a key
mysql> CREATE TABLE ACID_PROP(ID BIGINT PRIMARY KEY AUTO_INCREMENT, VALUE VARCHAR(30));
Query OK, 0 rows affected (0.02 sec)

mysql> START TRANSACTION;
Query OK, 0 rows affected (0.00 sec)

mysql> INSERT INTO ACID_PROP(VALUE) VALUES
    -> ('Rohit');
Query OK, 1 row affected (0.01 sec)

mysql> INSERT INTO ACID_PROP(VALUE) VALUES ('Rema');
Query OK, 1 row affected (0.00 sec)

mysql> COMMIT;
Query OK, 0 rows affected (0.01 sec)

mysql> SELECT * FROM ACID_PROP;
+----+-------+
| ID | VALUE |
+----+-------+
|  1 | Rohit |
|  2 | Rema  |
+----+-------+
2 rows in set (0.00 sec)

mysql> START TRANSACTION;
Query OK, 0 rows affected (0.01 sec)

mysql> INSERT INTO ACID_PROP(VALUE) VALUES ('Lola');
Query OK, 1 row affected (0.01 sec)

mysql> INSERT INTO ACID_PROP(VALUE) VALUES ('Zain');
Query OK, 1 row affected (0.01 sec)

mysql> SELECT * FROM ACID_PROP;
+----+-------+
| ID | VALUE |
+----+-------+
|  1 | Rohit |
|  2 | Rema  |
|  3 | Lola  |
|  4 | Zain  |
+----+-------+
4 rows in set (0.03 sec)

mysql> ALTER TABLE TBL ADD COLUMN COL2 INT;
ERROR 1146 (42S02): Table 'nirmala.tbl' doesn't exist
mysql> ROLLBACK;
Query OK, 0 rows affected (0.00 sec)

mysql> SELECT * FROM ACID_PROP;
+----+-------+
| ID | VALUE |
+----+-------+
|  1 | Rohit |
|  2 | Rema  |
|  3 | Lola  |
|  4 | Zain  |
+----+-------+
4 rows in set (0.01 sec)

mysql> #even after ROLLBACK the values added in 2nd transaction remains so DDL has corrupted the table 
mysql> #atomicity not maintained
mysql> 
mysql>  #isolation: transactions are independent of each other
mysql> 
mysql> START TRANSACTION;                                Query OK, 0 rows affected (0.00 sec)

mysql> INSERT INTO ACID_PROP(VALUE) VALUES ('Asher');
Query OK, 1 row affected (0.00 sec)

mysql> SELECT * FROM ACID_PROP;                          +----+-------+
| ID | VALUE |
+----+-------+
|  1 | Rohit |
|  2 | Rema  |
|  3 | Lola  |
|  4 | Zain  |
|  5 | Asher |
+----+-------+
5 rows in set (0.00 sec)

mysql> UPDATE ACID_PROP 
    -> SET VALUE='Zayn'
    -> WHERE ID=4;
Query OK, 1 row affected (0.02 sec)
Rows matched: 1  Changed: 1  Warnings: 0

mysql> SELECT * FROM ACID_PROP;
+----+-------+
| ID | VALUE |
+----+-------+
|  1 | Rohit |
|  2 | Rema  |
|  3 | Lola  |
|  4 | Zayn  |
|  5 | Asher |
+----+-------+
5 rows in set (0.00 sec)

mysql> COMMIT;
Query OK, 0 rows affected (0.00 sec)

mysql> SELECT * FROM ACID_PROP;
+----+-------+
| ID | VALUE |
+----+-------+
|  1 | Rohit |
|  2 | Rema  |
|  3 | Lola  |
|  4 | Zayn  |
|  5 | Asher |
+----+-------+
5 rows in set (0.00 sec)

mysql> BEGIN;
Query OK, 0 rows affected (0.01 sec)

mysql> UPDATE ACID_PROP SET VALUE='Ronald' WHERE ID=2
    -> ;
Query OK, 1 row affected (0.00 sec)
Rows matched: 1  Changed: 1  Warnings: 0

mysql> SELECT * FROM ACID_PROP;
+----+--------+
| ID | VALUE  |
+----+--------+
|  1 | Rohit  |
|  2 | Ronald |
|  3 | Lola   |
|  4 | Zayn   |
|  5 | Asher  |
+----+--------+
5 rows in set (0.00 sec)

mysql> COMMIT;
Query OK, 0 rows affected (0.01 sec)

mysql> SELECT * FROM ACID_PROP;
+----+--------+
| ID | VALUE  |
+----+--------+
|  1 | Rohit  |
|  2 | Ronald |
|  3 | Lola   |
|  4 | Zayn   |
|  5 | Asher  |
+----+--------+
5 rows in set (0.00 sec)

mysql> #before commit in W2
mysql> #after commit in W2
mysql> SELECT * FROM ACID_PROP;
+----+-------+
| ID | VALUE |
+----+-------+
|  1 | Rohit |
|  2 | Ryan  |
|  3 | Lola  |
|  4 | Zayn  |
|  5 | Asher |
+----+-------+
5 rows in set (0.00 sec)

mysql> 
mysql> #updating different id in different window
mysql> 
mysql> BEGIN;
Query OK, 0 rows affected (0.01 sec)

mysql> UPDATE ACID_PROP SET VALUE='Chris' WHERE ID=1;
Query OK, 1 row affected (0.00 sec)
Rows matched: 1  Changed: 1  Warnings: 0

mysql> SELECT * FROM ACID_PROP;
+----+-------+
| ID | VALUE |
+----+-------+
|  1 | Chris |
|  2 | Ryan  |
|  3 | Lola  |
|  4 | Zayn  |
|  5 | Asher |
+----+-------+
5 rows in set (0.01 sec)

mysql> COMMIT;
Query OK, 0 rows affected (0.00 sec)

mysql> SELECT * FROM ACID_PROP;
+----+-------+
| ID | VALUE |
+----+-------+
|  1 | Chris |
|  2 | Ryan  |
|  3 | Lola  |
|  4 | Zayn  |
|  5 | Asher |
+----+-------+
5 rows in set (0.01 sec)

mysql> SELECT * FROM ACID_PROP;
+----+--------+
| ID | VALUE  |
+----+--------+
|  1 | Sawyer |
|  2 | Ryan   |
|  3 | Olivia |
|  4 | Zayn   |
|  5 | Asher  |
+----+--------+
5 rows in set (0.00 sec)

mysql> SELECT * FROM PRODUCT;
+----+---------+------+
| ID | Name    | QTY  |
+----+---------+------+
|  1 | Laptop  |   90 |
|  2 | Desktop |   50 |
+----+---------+------+
2 rows in set (0.01 sec)

mysql> SELECT * FROM SALES;
Empty set (0.01 sec)

mysql> BEGIN;
Query OK, 0 rows affected (0.01 sec)

mysql> UPDATE PRODUCT
    -> SET QTY=QTY-10;
Query OK, 2 rows affected (0.00 sec)
Rows matched: 2  Changed: 2  Warnings: 0

mysql> INSERT INTO SALES(PRODUCT_ID,SOLD_QTY) VALUES (1,10), (2,10);
Query OK, 2 rows affected (0.00 sec)
Records: 2  Duplicates: 0  Warnings: 0

mysql> SELECT * FROM SALES;
+---------+------------+----------+
| SALE_ID | PRODUCT_ID | SOLD_QTY |
+---------+------------+----------+
|       1 |          1 |       10 |
|       2 |          2 |       10 |
+---------+------------+----------+
2 rows in set (0.00 sec)

mysql> #consistent
mysql> COMMIT;
Query OK, 0 rows affected (0.00 sec)

mysql> SELECT * FROM ACID_PROP;
+----+--------+
| ID | VALUE  |
+----+--------+
|  1 | Sawyer |
|  2 | Ryan   |
|  3 | Olivia |
|  4 | Zayn   |
|  5 | Asher  |
+----+--------+
5 rows in set (0.00 sec)

mysql> DELETE FROM ACID_PROP
    -> WHERE ID=3;
Query OK, 1 row affected (0.02 sec)

mysql> SELECT * FROM ACID_PROP;
+----+--------+
| ID | VALUE  |
+----+--------+
|  1 | Sawyer |
|  2 | Ryan   |
|  4 | Zayn   |
|  5 | Asher  |
+----+--------+
4 rows in set (0.00 sec)

mysql> SET AUTOCOMMIT=OFF;
Query OK, 0 rows affected (0.01 sec)

mysql> DELETE FROM ACID_PROP WHERE ID=5;
Query OK, 1 row affected (0.00 sec)

mysql> SELECT * FROM ACID_PROP;
+----+--------+
| ID | VALUE  |
+----+--------+
|  1 | Sawyer |
|  2 | Ryan   |
|  4 | Zayn   |
+----+--------+
3 rows in set (0.00 sec)

mysql> ROLLBACK;
Query OK, 0 rows affected (0.01 sec)

mysql> SELECT * FROM ACID_PROP;
+----+--------+
| ID | VALUE  |
+----+--------+
|  1 | Sawyer |
|  2 | Ryan   |
|  4 | Zayn   |
|  5 | Asher  |
+----+--------+
4 rows in set (0.00 sec)

mysql> SET AUTOCOMMIT=ON;
Query OK, 0 rows affected (0.01 sec)

mysql> 
mysql> 
mysql> #ISOLATION LEVELS
mysql> 
mysql>  #read uncommited
mysql> #T2 reads uncommited values from T1 - dirty read
mysql> 
mysql> SET SESSION TRANSACTION ISOLATION LEVEL READ UNCOMMITED;
ERROR 1064 (42000): You have an error in your SQL syntax; check the manual that corresponds to your MySQL server version for the right syntax to use near 'UNCOMMITED' at line 1
mysql> SET SESSION TRANSACTION ISOLATION LEVEL READ UNCOMMITTED;
Query OK, 0 rows affected (0.00 sec)

mysql> SELECT @@TRANSACTION_ISOLATION;
+-------------------------+
| @@TRANSACTION_ISOLATION |
+-------------------------+
| READ-UNCOMMITTED        |
+-------------------------+
1 row in set (0.00 sec)

mysql> SELECT * FROM PRODUCT;
+----+---------+------+
| ID | Name    | QTY  |
+----+---------+------+
|  1 | Laptop  |   80 |
|  2 | Desktop |   40 |
+----+---------+------+
2 rows in set (0.01 sec)

mysql> START TRANSACTION;
Query OK, 0 rows affected (0.00 sec)

mysql> UPDATE PRODUCT
    -> SET QTY=QTY-2
    -> WHERE ID=1;
Query OK, 1 row affected (0.01 sec)
Rows matched: 1  Changed: 1  Warnings: 0

mysql> SELECT SLEEP(10);
+-----------+
| SLEEP(10) |
+-----------+
|         0 |
+-----------+
1 row in set (10.08 sec)

mysql> ROLLBACK;
Query OK, 0 rows affected (0.00 sec)

mysql> SELECT * FROM PRODUCT;
+----+---------+------+
| ID | Name    | QTY  |
+----+---------+------+
|  1 | Laptop  |   80 |
|  2 | Desktop |   40 |
+----+---------+------+
2 rows in set (0.00 sec)

mysql> SET SESSION TRANSACTION ISOLATION LEVEL READ COMMITTED;
Query OK, 0 rows affected (0.00 sec)

mysql> SELECT @@TRANSACTION_ISOLATION;
+-------------------------+
| @@TRANSACTION_ISOLATION |
+-------------------------+
| READ-COMMITTED          |
+-------------------------+
1 row in set (0.01 sec)

mysql> SELECT * FROM PRODUCT;
+----+---------+------+
| ID | Name    | QTY  |
+----+---------+------+
|  1 | Laptop  |   83 |
|  2 | Desktop |   40 |
+----+---------+------+
2 rows in set (0.00 sec)

mysql> BEGIN;
Query OK, 0 rows affected (0.00 sec)

mysql> UPDATE PRODUCT SET QTY=QTY-2 WHERE ID=1;              Query OK, 1 row affected (0.00 sec)
Rows matched: 1  Changed: 1  Warnings: 0

mysql> SELECT * FROM PRODUCT;
+----+---------+------+
| ID | Name    | QTY  |
+----+---------+------+
|  1 | Laptop  |   81 |
|  2 | Desktop |   40 |
+----+---------+------+
2 rows in set (0.00 sec)

mysql> COMMIT;
Query OK, 0 rows affected (0.00 sec)

mysql> 
mysql> SET SESSION TRANSACTION ISOLATION LEVEL REPEATABLE READ;
Query OK, 0 rows affected (0.00 sec)

mysql> SELECT @@TRANSACTION_ISOLATION;                       +-------------------------+
| @@TRANSACTION_ISOLATION |
+-------------------------+
| REPEATABLE-READ         |
+-------------------------+
1 row in set (0.00 sec)

mysql> BEGIN;
Query OK, 0 rows affected (0.00 sec)

mysql> SELECT * FROM PRODUCT WHERE ID=1;
+----+--------+------+
| ID | Name   | QTY  |
+----+--------+------+
|  1 | Laptop |   81 |
+----+--------+------+
1 row in set (0.00 sec)

mysql> SELECT * FROM PRODUCT WHERE ID=1;
+----+--------+------+
| ID | Name   | QTY  |
+----+--------+------+
|  1 | Laptop |   81 |
+----+--------+------+
1 row in set (0.00 sec)

mysql> #updation done on T2 but qty remains same
mysql> #i.e. on repeated reading the value doesn't change
mysql> 
mysql> COMMIT;
Query OK, 0 rows affected (0.00 sec)

mysql> BEGIN;
Query OK, 0 rows affected (0.00 sec)

mysql> SELECT * FROM PRODUCT;
+----+---------+------+
| ID | Name    | QTY  |
+----+---------+------+
|  1 | Laptop  |   78 |
|  2 | Desktop |   40 |
+----+---------+------+
2 rows in set (0.00 sec)

mysql> UPDATE PRODUCT SET QTY=QTY-1 WHERE ID=2;
Query OK, 1 row affected (0.00 sec)
Rows matched: 1  Changed: 1  Warnings: 0

mysql> SELECT * FROM PRODUCT;
+----+---------+------+
| ID | Name    | QTY  |
+----+---------+------+
|  1 | Laptop  |   78 |
|  2 | Desktop |   39 |
+----+---------+------+
2 rows in set (0.01 sec)

mysql> COMMIT;
Query OK, 0 rows affected (0.00 sec)

mysql> #phantom read
mysql> 
mysql> BEGIN;
Query OK, 0 rows affected (0.00 sec)

mysql> SELECT * FROM PRODUCT;
+----+---------+------+
| ID | Name    | QTY  |
+----+---------+------+
|  1 | Laptop  |   78 |
|  2 | Desktop |   38 |
+----+---------+------+
2 rows in set (0.00 sec)

mysql> SELECT Name FROM PRODUCT WHERE QTY>40;
+--------+
| Name   |
+--------+
| Laptop |
+--------+
1 row in set (0.01 sec)

mysql> SELECT Name FROM PRODUCT WHERE QTY>40;
+--------+
| Name   |
+--------+
| Laptop |
+--------+
1 row in set (0.00 sec)
mysql> #even after commit query gives same output even though iPad qty>40 => on repeatable read gives same values in a transaction
mysql> COMMIT;
Query OK, 0 rows affected (0.00 sec)

mysql> 
mysql> 
mysql> SET SESSION TRANSACTION ISOLATION LEVEL SERIALIZABLE;
Query OK, 0 rows affected (0.00 sec)

mysql> SELECT @@TRANSACTION_ISOLATION; 
+-------------------------+
| @@TRANSACTION_ISOLATION |
+-------------------------+
| SERIALIZABLE            |
+-------------------------+
1 row in set (0.00 sec)

mysql> BEGIN;
Query OK, 0 rows affected (0.00 sec)

mysql> UPDATE PRODUCT
    -> SET QTY=QTY-3
    -> WHERE ID=1;
ERROR 1205 (HY000): Lock wait timeout exceeded; try restarting transaction
mysql> #even though we are updating different id than what was updated in T2 it won't update since serializable locks the entire table
mysql> 
mysql> BEGIN;
Query OK, 0 rows affected (0.00 sec)

mysql> UPDATE PRODUCT SET QTY=QTY-3 WHERE ID=1;              Query OK, 1 row affected (16.18 sec)
Rows matched: 1  Changed: 1  Warnings: 0

mysql> SELECT * FROM PRODUCT;
+----+---------+------+
| ID | Name    | QTY  |
+----+---------+------+
|  1 | Laptop  |   75 |
|  2 | Desktop |   38 |
|  4 | IPad    |   85 |
+----+---------+------+
3 rows in set (0.00 sec)

mysql> #as soon as T2 commits(entire table unlocked) so T1 gets executed
mysql> 
mysql> 
mysql> SET SESSION TRANSACTION ISOLATION LEVEL READ UNCOMMITTED;
Query OK, 0 rows affected (0.00 sec)

mysql> BEGIN;
Query OK, 0 rows affected (0.00 sec)

mysql> SELECT * FROM PRODUCT;
+----+---------+------+
| ID | Name    | QTY  |
+----+---------+------+
|  1 | Laptop  |   75 |
|  2 | Desktop |   38 |
|  4 | IPad    |   85 |
+----+---------+------+
3 rows in set (0.00 sec)

mysql> UPDATE PRODUCT SET QTY=QTY-5  WHERE ID=1;
Query OK, 1 row affected (0.00 sec)
Rows matched: 1  Changed: 1  Warnings: 0

mysql> SELECT * FROM PRODUCT;
+----+---------+------+
| ID | Name    | QTY  |
+----+---------+------+
|  1 | Laptop  |   70 |
|  2 | Desktop |   38 |
|  4 | IPad    |   85 |
+----+---------+------+
3 rows in set (0.00 sec)

mysql> COMMIT;
Query OK, 0 rows affected (0.00 sec)

mysql> SET SESSION TRANSACTION ISOLATION LEVEL REPEATABLE READ;
Query OK, 0 rows affected (0.02 sec)

mysql> SELECT @@TRANSACTION_ISOLATION;
+-------------------------+
| @@TRANSACTION_ISOLATION |
+-------------------------+
| REPEATABLE-READ         |
+-------------------------+
1 row in set (0.00 sec)

mysql> SELECT * FROM PRODUCT;
+----+---------+------+
| ID | Name    | QTY  |
+----+---------+------+
|  1 | Laptop  |   70 |
|  2 | Desktop |   38 |
|  4 | IPad    |   85 |
+----+---------+------+
3 rows in set (0.00 sec)

mysql> BEGIN;
Query OK, 0 rows affected (0.00 sec)

mysql> SELECT * FROM PRODUCT WHERE QTY>40;
+----+--------+------+
| ID | Name   | QTY  |
+----+--------+------+
|  1 | Laptop |   70 |
|  4 | IPad   |   85 |
+----+--------+------+
2 rows in set (0.00 sec)

mysql> SELECT * FROM PRODUCT WHERE QTY>40;
+----+--------+------+
| ID | Name   | QTY  |
+----+--------+------+
|  1 | Laptop |   70 |
|  4 | IPad   |   85 |
+----+--------+------+
2 rows in set (0.00 sec)

mysql> SELECT * FROM PRODUCT;
+----+---------+------+
| ID | Name    | QTY  |
+----+---------+------+
|  1 | Laptop  |   70 |
|  2 | Desktop |   38 |
|  4 | IPad    |   85 |
+----+---------+------+
3 rows in set (0.00 sec)

mysql> SELECT * FROM PRODUCT WHERE QTY>40;
+----+--------+------+
| ID | Name   | QTY  |
+----+--------+------+
|  1 | Laptop |   70 |
|  4 | IPad   |   85 |
+----+--------+------+
2 rows in set (0.00 sec)

mysql> commit;
Query OK, 0 rows affected (0.00 sec)

mysql> 
mysql> 
mysql> #phantom row
mysql> 
mysql> 
mysql> 
mysql> SET SESSION TRANSACTION ISOLATION LEVEL REPEATABLE READ;
Query OK, 0 rows affected (0.01 sec)

mysql> SET SESSION TRANSACTION ISOLATION LEVEL READ UNCOMMITTED;
Query OK, 0 rows affected (0.00 sec)

mysql> SELECT @@TRANSACTION_ISOLATION;
+-------------------------+
| @@TRANSACTION_ISOLATION |
+-------------------------+
| READ-UNCOMMITTED        |
+-------------------------+
1 row in set (0.00 sec)

mysql> BEGIN;
Query OK, 0 rows affected (0.01 sec)

mysql> SELECT * FROM PRODUCTS WHERE QTY>50;
ERROR 1146 (42S02): Table 'nirmala.products' doesn't exist
mysql> SELECT * FROM PRODUCT WHERE QTY>50;
+----+-----------+------+
| ID | Name      | QTY  |
+----+-----------+------+
|  1 | Laptop    |   70 |
|  4 | IPad      |   85 |
|  5 | Earphones |   90 |
+----+-----------+------+
3 rows in set (0.01 sec)

mysql> SELECT * FROM PRODUCT WHERE QTY>50;
+----+------------+------+
| ID | Name       | QTY  |
+----+------------+------+
|  1 | Laptop     |   70 |
|  4 | IPad       |   85 |
|  5 | Earphones  |   90 |
|  6 | Headphones |  100 |
+----+------------+------+
4 rows in set (0.00 sec)

mysql> #for same query 2nd time a new row appears => phantom row
mysql> COMMIT;
Query OK, 0 rows affected (0.00 sec)

mysql> SET SESSION TRANSACTION ISOLATION LEVEL REPEATABLE READ;
Query OK, 0 rows affected (0.00 sec)

mysql> 
