Last login: Thu Apr 27 11:59:03 on ttys001

The default interactive shell is now zsh.
To update your account to use zsh, please run `chsh -s /bin/zsh`.
For more details, please visit https://support.apple.com/kb/HT208050.
nirmala-pt7167:~ nirmala-pt7167$ mysql -u root
Welcome to the MySQL monitor.  Commands end with ; or \g.
Your MySQL connection id is 33
Server version: 5.7.41 Homebrew

Copyright (c) 2000, 2023, Oracle and/or its affiliates.

Oracle is a registered trademark of Oracle Corporation and/or its
affiliates. Other names may be trademarks of their respective
owners.

Type 'help;' or '\h' for help. Type '\c' to clear the current input statement.

mysql> USE NIRMALA;
Reading table information for completion of table and column names
You can turn off this feature to get a quicker startup with -A

Database changed
mysql> SELECT * FROM TEACHERS;
+-----+---------+-----------+
| TID | NAME    | COURSE_ID |
+-----+---------+-----------+
|   1 | Maya    | CS-101    |
|   2 | Anu     | BIO-301   |
|   3 | Patrick | CS-315    |
+-----+---------+-----------+
3 rows in set (0.00 sec)

mysql> SELECT * FROM COURSE;
+-----------+---------------+------------+---------+
| COURSE_ID | TITLE         | DEPT_NAME  | CREDITS |
+-----------+---------------+------------+---------+
| BIO-101   | Basic Biology | Biology    |       4 |
| BIO-301   | Genetics      | Biology    |       4 |
| CS-101    | Basic Prgm    | Comp. Sci. |       3 |
| CS-190    | Game Design   | Comp. Sci. |       4 |
| CS-315    | Robotocs      | Comp. Sci. |       3 |
+-----------+---------------+------------+---------+
5 rows in set (0.00 sec)

mysql> SELECT * FROM STUDENTS;
+-----+---------+-------+--------+------------+-----------+--------+------+--------+
| ID  | ROLL_NO | FNAME | LNAME  | DOB        | DEPT_CODE | GENDER | FEES | COURSE |
+-----+---------+-------+--------+------------+-----------+--------+------+--------+
| S01 |    1001 | Lallu | Dubey  | 1999-01-06 | CS01      | M      | 5000 | CS-101 |
| S02 |    1002 | Priya | Kumari | 1998-12-04 | EE01      | F      | 5000 | NULL   |
+-----+---------+-------+--------+------------+-----------+--------+------+--------+
2 rows in set (0.00 sec)

mysql> SELECT * FROM STUDENTS;
+-----+---------+-------+----------+------------+-----------+--------+------+--------+
| ID  | ROLL_NO | FNAME | LNAME    | DOB        | DEPT_CODE | GENDER | FEES | COURSE |
+-----+---------+-------+----------+------------+-----------+--------+------+--------+
| S01 |    1001 | Lallu | Dubey    | 1999-01-06 | CS01      | M      | 5000 | CS-101 |
| S02 |    1002 | Priya | Kumari   | 1998-12-04 | EE01      | F      | 5000 | NULL   |
| S03 |    1003 | Lilly | Erickson | 2000-05-21 | CS02      | F      | 6700 | CS-315 |
+-----+---------+-------+----------+------------+-----------+--------+------+--------+
3 rows in set (0.00 sec)

mysql> SELECT * FROM COURSE;
+-----------+------------------+------------+---------+
| COURSE_ID | TITLE            | DEPT_NAME  | CREDITS |
+-----------+------------------+------------+---------+
| BIO-101   | Basic Biology    | Biology    |       4 |
| BIO-301   | Genetics         | Biology    |       4 |
| CS-101    | Basic Prgm       | Comp. Sci. |       3 |
| CS-190    | Game Design      | Comp. Sci. |       4 |
| CS-315    | Robotocs         | Comp. Sci. |       3 |
| EE-216    | Electromagnetism | Electrical |       4 |
+-----------+------------------+------------+---------+
6 rows in set (0.01 sec)

mysql> SELECT * FROM TEACHERS;
+-----+---------+-----------+
| TID | NAME    | COURSE_ID |
+-----+---------+-----------+
|   1 | Maya    | CS-101    |
|   2 | Anu     | BIO-301   |
|   3 | Patrick | CS-315    |
|   5 | Reena   | EE-216    |
+-----+---------+-----------+
4 rows in set (0.01 sec)

mysql> #rollback transaction
mysql> 
mysql> SELECT * FROM TEACHERS;
+-----+---------+-----------+
| TID | NAME    | COURSE_ID |
+-----+---------+-----------+
|   1 | Maya    | CS-101    |
|   2 | Anu     | BIO-301   |
|   3 | Patrick | CS-315    |
|   5 | Reena   | EE-216    |
+-----+---------+-----------+
4 rows in set (0.01 sec)

mysql> #after deletion TEACHERS table still has rows since we haven't commited yet
mysql> 
mysql> SELECT * FROM TEACHERS;                            +-----+---------+-----------+
| TID | NAME    | COURSE_ID |
+-----+---------+-----------+
|   1 | Maya    | CS-101    |
|   2 | Anu     | BIO-301   |
|   3 | Patrick | CS-315    |
|   5 | Reena   | EE-216    |
|   6 | Arun    | CS-190    |
|   8 | Ajitha  | BIO-101   |
+-----+---------+-----------+
6 rows in set (0.00 sec)

mysql> #ACID PROPERTIES
mysql> #isolation
mysql> 
mysql> START TRANSACTION;
Query OK, 0 rows affected (0.00 sec)

mysql> SELECT * FROM ACID_PROP;
+----+-------+
| ID | VALUE |
+----+-------+
|  1 | Rohit |
|  2 | Rema  |
|  3 | Lola  |
|  4 | Zain  |
+----+-------+
4 rows in set (0.00 sec)

mysql> #changes made in transaction not reflected here
mysql> #changes there have been commited
mysql> SELECT * FROM ACID_PROP;
+----+-------+
| ID | VALUE |
+----+-------+
|  1 | Rohit |
|  2 | Rema  |
|  3 | Lola  |
|  4 | Zain  |
+----+-------+
4 rows in set (0.00 sec)

mysql> #but still no chhange here
mysql> #implies transactions are independent of each other 
mysql> COMMIT;
Query OK, 0 rows affected (0.00 sec)

mysql> #start new transaction after commiting changes
mysql> 
mysql> START TRANSACTION;
Query OK, 0 rows affected (0.00 sec)

mysql> SELECT * FROM ACID_PROP;
+----+-------+
| ID | VALUE |
+----+-------+
|  1 | Rohit |
|  2 | Rema  |
|  3 | Lola  |
|  4 | Zayn  |
|  5 | Asher |
+----+-------+
5 rows in set (0.00 sec)

mysql> UPDATE ACID_PROP SET VALUE='Ryan' WHERE ID=2
    -> ;
ERROR 1205 (HY000): Lock wait timeout exceeded; try restarting transaction
mysql> SELECT * FROM ACID_PROP;
+----+-------+
| ID | VALUE |
+----+-------+
|  1 | Rohit |
|  2 | Rema  |
|  3 | Lola  |
|  4 | Zayn  |
|  5 | Asher |
+----+-------+
5 rows in set (0.00 sec)

mysql> BEGIN;
Query OK, 0 rows affected (0.00 sec)

mysql> UPDATE ACID_PROP SET VALUE='Ryan' WHERE ID=2;
Query OK, 1 row affected (4.04 sec)
Rows matched: 1  Changed: 1  Warnings: 0

mysql> #we started a transaction in W1 to update ID=2
mysql> #at the same we started another transaction in this window simultaneously to update ID 2 value to 'Ryan'
mysql> #when we 1st did update in this window we see that timeout exceeded => it was waiting for transaction in W1 to complete
mysql> #once we commited changes in W1, the update in W2 executed
mysql> COMMIT;
Query OK, 0 rows affected (0.02 sec)

mysql> SELECT * FROM ACID_PROP;
+----+-------+
| ID | VALUE |
+----+-------+
|  1 | Rohit |
|  2 | Ryan  |
|  3 | Lola  |
|  4 | Zayn  |
|  5 | Asher |
+----+-------+
5 rows in set (0.01 sec)

mysql> BEGIN;
Query OK, 0 rows affected (0.00 sec)

mysql> UPDATE ACID_PROP SET VALUE='Olivia' WHERE ID=3;
Query OK, 1 row affected (0.00 sec)
Rows matched: 1  Changed: 1  Warnings: 0

mysql> #update got executed in this case since different rows are being updated in W1 and W2
mysql> SELECT * FROM ACID_PROP;
+----+--------+
| ID | VALUE  |
+----+--------+
|  1 | Rohit  |
|  2 | Ryan   |
|  3 | Olivia |
|  4 | Zayn   |
|  5 | Asher  |
+----+--------+
5 rows in set (0.01 sec)

mysql> #when a row is updated it gets locked by database till transaction is over
mysql> UPDATE ACID_PROP SET VALUE='Sawyer' WHERE ID=1;
Query OK, 1 row affected (12.41 sec)
Rows matched: 1  Changed: 1  Warnings: 0

mysql> #updating row with Id=1 it waits till transaction in W1 was over(12.41 sec)
mysql> COMMIT;
Query OK, 0 rows affected (0.01 sec)

mysql> SELECT * FROM ACID_PROP;                           +----+--------+
| ID | VALUE  |
+----+--------+
|  1 | Sawyer |
|  2 | Ryan   |
|  4 | Zayn   |
|  5 | Asher  |
+----+--------+
4 rows in set (0.00 sec)

mysql> #autocommit set off so even though we deleted Asher in W1 it is shown in W2 since delete operation wasn't commited
mysql> 
mysql>                                                    
mysql> 
mysql> #ISOLATION LEVELS
mysql> 
mysql> #read uncommited
mysql> 
mysql> SET SESSION TRANSACTION ISOLATION LEVEL READ UNCOMMITTED;
Query OK, 0 rows affected (0.01 sec)

mysql> SELECT @@TRANSACTION_ISOLATION;
+-------------------------+
| @@TRANSACTION_ISOLATION |
+-------------------------+
| READ-UNCOMMITTED        |
+-------------------------+
1 row in set (0.01 sec)

mysql> SELECT * FROM PRODUCT;
+----+---------+------+
| ID | Name    | QTY  |
+----+---------+------+
|  1 | Laptop  |   78 |
|  2 | Desktop |   40 |
+----+---------+------+
2 rows in set (0.01 sec)

mysql> #not yet commited T1 but qty updated to 78
mysql> #T2 read uncommited value from T1
mysql> 
mysql> SET SESSION TRANSACTION ISOLATION LEVEL READ COMMITTED;
Query OK, 0 rows affected (0.00 sec)

mysql> SELECT @@TRANSACTION_ISOLATION;
+-------------------------+
| @@TRANSACTION_ISOLATION |
+-------------------------+
| READ-COMMITTED          |
+-------------------------+
1 row in set (0.01 sec)

mysql> SELECT * FROM PRODUCT;
+----+---------+------+
| ID | Name    | QTY  |
+----+---------+------+
|  1 | Laptop  |   83 |
|  2 | Desktop |   40 |
+----+---------+------+
2 rows in set (0.00 sec)

mysql> BEGIN;
Query OK, 0 rows affected (0.00 sec)

mysql> SELECT * FROM PRODUCT WHERE ID=1;
+----+--------+------+
| ID | Name   | QTY  |
+----+--------+------+
|  1 | Laptop |   83 |
+----+--------+------+
1 row in set (0.00 sec)

mysql> SELECT * FROM PRODUCT WHERE ID=1;
+----+--------+------+
| ID | Name   | QTY  |
+----+--------+------+
|  1 | Laptop |   81 |
+----+--------+------+
1 row in set (0.00 sec)

mysql> #reads only commited values
mysql> 
mysql> commit;
Query OK, 0 rows affected (0.00 sec)

mysql> SET SESSION TRANSACTION ISOLATION LEVEL REPEATABLE READ;
Query OK, 0 rows affected (0.00 sec)

mysql> SELECT @@TRANSACTION_ISOLATION;
+-------------------------+
| @@TRANSACTION_ISOLATION |
+-------------------------+
| REPEATABLE-READ         |
+-------------------------+
1 row in set (0.00 sec)

mysql> BEGIN;
Query OK, 0 rows affected (0.00 sec)

mysql> SELECT * FROM PRODUCT WHERE ID=1;                     +----+--------+------+
| ID | Name   | QTY  |
+----+--------+------+
|  1 | Laptop |   81 |
+----+--------+------+
1 row in set (0.00 sec)

mysql> UPDATE PRODUCT 
    -> SET QTY=QTY-3
    -> WHERE ID=1;
Query OK, 1 row affected (0.00 sec)
Rows matched: 1  Changed: 1  Warnings: 0

mysql> COMMIT;
Query OK, 0 rows affected (0.00 sec)

mysql> BEGIN;
Query OK, 0 rows affected (0.00 sec)

mysql> SELECT * FROM PRODUCT;
+----+---------+------+
| ID | Name    | QTY  |
+----+---------+------+
|  1 | Laptop  |   78 |
|  2 | Desktop |   40 |
+----+---------+------+
2 rows in set (0.00 sec)

mysql> SELECT * FROM PRODUCT;
+----+---------+------+
| ID | Name    | QTY  |
+----+---------+------+
|  1 | Laptop  |   78 |
|  2 | Desktop |   40 |
+----+---------+------+
2 rows in set (0.00 sec)

mysql> UPDATE PRODUCT SET QTY=QTY-1 WHERE ID=2;
Query OK, 1 row affected (18.01 sec)
Rows matched: 1  Changed: 1  Warnings: 0

mysql> SELECT * FROM PRODUCT;
+----+---------+------+
| ID | Name    | QTY  |
+----+---------+------+
|  1 | Laptop  |   78 |
|  2 | Desktop |   38 |
+----+---------+------+
2 rows in set (0.00 sec)

mysql> COMMIT;
Query OK, 0 rows affected (0.00 sec)

mysql> #phantom read
mysql> 
mysql> BEGIN;
Query OK, 0 rows affected (0.01 sec)

mysql> SELECT * FROM PRODUCT;
+----+---------+------+
| ID | Name    | QTY  |
+----+---------+------+
|  1 | Laptop  |   78 |
|  2 | Desktop |   38 |
+----+---------+------+
2 rows in set (0.01 sec)

mysql> INSERT INTO PRODUCT(Name,QTY) VALUES ('IPad',89);
Query OK, 1 row affected (0.00 sec)

mysql> COMMIT;
Query OK, 0 rows affected (0.00 sec)

mysql> SELECT * FROM PRODUCT;
+----+---------+------+
| ID | Name    | QTY  |
+----+---------+------+
|  1 | Laptop  |   78 |
|  2 | Desktop |   38 |
|  4 | IPad    |   89 |
+----+---------+------+
3 rows in set (0.00 sec)

mysql> SET SESSION TRANSACTION ISOLATION LEVEL SERIALIZABLE;
Query OK, 0 rows affected (0.01 sec)

mysql> SELECT @@TRANSACTION_ISOLATION;                       +-------------------------+
| @@TRANSACTION_ISOLATION |
+-------------------------+
| SERIALIZABLE            |
+-------------------------+
1 row in set (0.00 sec)

mysql> BEGIN;
Query OK, 0 rows affected (0.00 sec)

mysql> SELECT * FROM PRODUCT;
+----+---------+------+
| ID | Name    | QTY  |
+----+---------+------+
|  1 | Laptop  |   78 |
|  2 | Desktop |   38 |
|  4 | IPad    |   89 |
+----+---------+------+
3 rows in set (0.00 sec)

mysql> UPDATE PRODUCT
    -> SET QTY=QTY-4
    -> WHERE ID=4;
Query OK, 1 row affected (29.69 sec)
Rows matched: 1  Changed: 1  Warnings: 0

mysql> SELECT * FROM PRODUCT;
+----+---------+------+
| ID | Name    | QTY  |
+----+---------+------+
|  1 | Laptop  |   78 |
|  2 | Desktop |   38 |
|  4 | IPad    |   85 |
+----+---------+------+
3 rows in set (0.00 sec)

mysql> COMMIT;
Query OK, 0 rows affected (0.00 sec)

mysql> 
mysql> 
mysql> 
mysql> SET SESSION TRANSACTION ISOLATION LEVEL READ UNCOMMITTED;
Query OK, 0 rows affected (0.00 sec)

mysql> 
mysql> BEGIN;
Query OK, 0 rows affected (0.00 sec)

mysql> SELECT * FROM PRODUCT;
+----+---------+------+
| ID | Name    | QTY  |
+----+---------+------+
|  1 | Laptop  |   70 |
|  2 | Desktop |   38 |
|  4 | IPad    |   85 |
+----+---------+------+
3 rows in set (0.00 sec)

mysql> #uncommited change read here
mysql> 
mysql> COMMIT;
Query OK, 0 rows affected (0.00 sec)

mysql> SET SESSION TRANSACTION ISOLATION LEVEL REPEATABLE READ;
Query OK, 0 rows affected (0.01 sec)

mysql> SELECT @@TRANSACTION_ISOLATION;
+-------------------------+
| @@TRANSACTION_ISOLATION |
+-------------------------+
| REPEATABLE-READ         |
+-------------------------+
1 row in set (0.01 sec)

mysql> BEGIN;
Query OK, 0 rows affected (0.00 sec)

mysql> INSERT INTO PRODUCT(Name,QTY) values
    -> ('Earphones',90);
Query OK, 1 row affected (0.01 sec)

mysql> commit;
Query OK, 0 rows affected (0.00 sec)

mysql> commit;
Query OK, 0 rows affected (0.00 sec)

mysql> 
mysql> #phantom row
mysql> 
mysql> SET SESSION TRANSACTION ISOLATION LEVEL READ UNCOMMITTED;
Query OK, 0 rows affected (0.00 sec)

mysql> SELECT @@TRANSACTION_ISOLATION;                       +-------------------------+
| @@TRANSACTION_ISOLATION |
+-------------------------+
| READ-UNCOMMITTED        |
+-------------------------+
1 row in set (0.00 sec)

mysql> BEGIN;
Query OK, 0 rows affected (0.00 sec)

mysql> INSERT INTO PRODUCT(Name,QTY) values ('Headphones',100);
Query OK, 1 row affected (0.00 sec)

mysql> COMMIT;
Query OK, 0 rows affected (0.01 sec)

mysql> SET SESSION TRANSACTION ISOLATION LEVEL REPEATABLE READ;
Query OK, 0 rows affected (0.01 sec)

mysql> 
